{
  "$schema": "http://json-schema.org/draft-07/schema#",
  "$id": "urn:forensic-agent-skills:schema:rebuild-status:1.0",
  "title": "Rebuild Status",
  "description": "Phase 2 服务器重建执行状态",
  "type": "object",
  "additionalProperties": false,
  "required": [
    "schema_version", "plan_id", "route_id",
    "source_artifacts", "working_artifacts",
    "backend", "backend_profile",
    "current_stage", "overall_status",
    "stages", "recovery_policy",
    "rollback_available", "can_continue_on_failure", "updated_at"
  ],
  "properties": {
    "schema_version": { "type": "string", "const": "1.0" },
    "plan_id": { "type": "string" },
    "route_id": {
      "type": "string",
      "pattern": "^route-[0-9a-f]{8}-[0-9a-f]{4}-[0-9a-f]{4}-[0-9a-f]{4}-[0-9a-f]{12}$"
    },
    "source_artifacts": {
      "type": "array",
      "items": {
        "type": "object",
        "$ref": "urn:forensic-agent-skills:schema:artifact-record:1.0"
      }
    },
    "working_artifacts": {
      "type": "array",
      "items": {
        "type": "object",
        "additionalProperties": false,
        "required": ["artifact_id", "source_artifact_id", "path", "type", "hash", "created_at"],
        "properties": {
          "artifact_id": {
            "type": "string",
            "pattern": "^artifact-[0-9a-f]{8}-[0-9a-f]{4}-[0-9a-f]{4}-[0-9a-f]{4}-[0-9a-f]{12}$"
          },
          "source_artifact_id": {
            "type": "string",
            "pattern": "^artifact-[0-9a-f]{8}-[0-9a-f]{4}-[0-9a-f]{4}-[0-9a-f]{4}-[0-9a-f]{12}$"
          },
          "path": { "type": "string" },
          "type": { "type": "string" },
          "hash": {
            "type": "object",
            "additionalProperties": false,
            "required": ["algorithm", "value", "status"],
            "properties": {
              "algorithm": { "type": "string" },
              "value": { "type": ["string", "null"] },
              "status": {
                "type": "string",
                "enum": ["verified", "provided", "deferred", "unavailable"]
              }
            }
          },
          "created_at": { "type": "string", "format": "date-time" }
        }
      }
    },
    "backend": {
      "type": "string",
      "enum": ["vmware", "qemu", "virtualbox", "docker", "wsl", "manual"]
    },
    "backend_profile": { "type": "object" },
    "current_stage": { "type": "integer", "minimum": 0, "maximum": 6 },
    "overall_status": {
      "type": "string",
      "enum": ["pending", "in_progress", "blocked", "partial", "completed", "failed", "rolled_back"]
    },
    "stages": {
      "type": "array",
      "items": {
        "type": "object",
        "additionalProperties": false,
        "required": ["stage", "name", "status", "attempt", "commands"],
        "properties": {
          "stage": { "type": "integer", "minimum": 0, "maximum": 6 },
          "name": {
            "type": "string",
            "enum": [
              "plan-validation-preflight",
              "workspace-source-preservation",
              "artifact-preparation",
              "runtime-configuration",
              "network-configuration",
              "runtime-launch-stabilization",
              "service-discovery-connection-handoff"
            ]
          },
          "status": {
            "type": "string",
            "enum": ["pending", "in_progress", "retrying", "blocked", "completed", "failed", "skipped", "rolled_back"]
          },
          "attempt": { "type": "integer", "minimum": 0 },
          "started_at": { "type": ["string", "null"], "format": "date-time" },
          "completed_at": { "type": ["string", "null"], "format": "date-time" },
          "commands": {
            "type": "array",
            "items": {
              "type": "object",
              "additionalProperties": false,
              "required": ["command"],
              "properties": {
                "command": { "type": "string" },
                "exit_code": { "type": ["integer", "null"] },
                "stdout_path": { "type": ["string", "null"] },
                "stderr_path": { "type": ["string", "null"] }
              }
            }
          },
          "outputs": { "type": "object" },
          "evidence_event_ids": {
            "type": "array",
            "items": {
              "type": "string",
              "pattern": "^led-[0-9a-f]{8}-[0-9a-f]{4}-[0-9a-f]{4}-[0-9a-f]{4}-[0-9a-f]{12}$"
            }
          },
          "rollback_checkpoint": { "type": ["string", "null"] },
          "error_class": { "type": ["string", "null"] },
          "error_message": { "type": ["string", "null"] },
          "next_stage": { "type": ["integer", "null"], "minimum": 0, "maximum": 6 }
        }
      }
    },
    "recovery_policy": {
      "type": "object",
      "$ref": "urn:forensic-agent-skills:schema:recovery-policy:1.0"
    },
    "rollback_available": { "type": "boolean" },
    "can_continue_on_failure": { "type": "boolean" },
    "updated_at": { "type": "string", "format": "date-time" }
  }
}
