{
  "schema_version": "1.0",
  "plan_id": "plan-001",
  "route_id": "route-aaaaaaaa-bbbb-cccc-dddd-eeeeeeeeeeee",
  "source_artifacts": [
    {
      "schema_version": "1.0",
      "artifact_id": "artifact-11111111-2222-3333-4444-555555555555",
      "path": "/evidence/disk.E01",
      "size": 1073741824,
      "hash": {
        "algorithm": "sha256",
        "value": "abc123def456",
        "status": "verified"
      },
      "preservation_status": "original-reference",
      "deferred_reason": null,
      "source": "题目附件",
      "material_type": "disk-image",
      "created_at": null,
      "source_artifact_id": null
    }
  ],
  "working_artifacts": [
    {
      "artifact_id": "artifact-66666666-7777-8888-9999-aaaaaaaaaaaa",
      "source_artifact_id": "artifact-11111111-2222-3333-4444-555555555555",
      "path": "/work/disk.qcow2",
      "type": "qcow2",
      "hash": {
        "algorithm": "sha256",
        "value": "def789abc012",
        "status": "verified"
      },
      "created_at": "2026-07-10T12:05:00Z"
    }
  ],
  "backend": "qemu",
  "backend_profile": {"memory_mb": 2048, "cpus": 2},
  "current_stage": 3,
  "overall_status": "in_progress",
  "stages": [
    {"stage": 0, "name": "plan-validation-preflight", "status": "completed", "attempt": 1, "commands": [{"command": "qemu-img --version"}], "outputs": {}, "evidence_event_ids": [], "rollback_checkpoint": null, "error_class": null, "error_message": null, "next_stage": 1, "started_at": null, "completed_at": null},
    {"stage": 1, "name": "workspace-source-preservation", "status": "completed", "attempt": 1, "commands": [{"command": "mkdir -p /work"}], "outputs": {}, "evidence_event_ids": [], "rollback_checkpoint": null, "error_class": null, "error_message": null, "next_stage": 2, "started_at": null, "completed_at": null},
    {"stage": 2, "name": "artifact-preparation", "status": "completed", "attempt": 1, "commands": [{"command": "qemu-img convert"}], "outputs": {}, "evidence_event_ids": [], "rollback_checkpoint": null, "error_class": null, "error_message": null, "next_stage": 3, "started_at": null, "completed_at": null},
    {"stage": 3, "name": "runtime-configuration", "status": "in_progress", "attempt": 1, "commands": [], "outputs": {}, "evidence_event_ids": [], "rollback_checkpoint": null, "error_class": null, "error_message": null, "next_stage": 4, "started_at": null, "completed_at": null},
    {"stage": 4, "name": "network-configuration", "status": "pending", "attempt": 0, "commands": [], "outputs": {}, "evidence_event_ids": [], "rollback_checkpoint": null, "error_class": null, "error_message": null, "next_stage": 5, "started_at": null, "completed_at": null},
    {"stage": 5, "name": "runtime-launch-stabilization", "status": "pending", "attempt": 0, "commands": [], "outputs": {}, "evidence_event_ids": [], "rollback_checkpoint": null, "error_class": null, "error_message": null, "next_stage": 6, "started_at": null, "completed_at": null},
    {"stage": 6, "name": "service-discovery-connection-handoff", "status": "pending", "attempt": 0, "commands": [], "outputs": {}, "evidence_event_ids": [], "rollback_checkpoint": null, "error_class": null, "error_message": null, "next_stage": null, "started_at": null, "completed_at": null}
  ],
  "recovery_policy": {
    "schema_version": "1.0",
    "operations": {
      "artifact_export": {
        "required_capability": "ewf-export",
        "error_classes": {
          "tool_failure": {"auto_retry": true, "max_attempts": 2, "tool_candidates": [{"tool": "ewfexport", "operation": "export"}], "action": "retry"}
        }
      },
      "disk_format_conversion": {
        "required_capability": "disk-format-conversion",
        "error_classes": {
          "tool_failure": {"auto_retry": true, "max_attempts": 2, "tool_candidates": [{"tool": "qemu-img", "operation": "convert"}], "action": "retry"}
        }
      },
      "runtime_configuration": {
        "error_classes": {
          "config_generation_failure": {"auto_retry": false, "fallback_backends": ["qemu"], "action": "fallback"}
        }
      },
      "runtime_launch": {
        "error_classes": {
          "startup_timeout": {"auto_retry": true, "max_attempts": 1, "timeout_seconds": 120, "fallback_backends": ["qemu"], "action": "fallback"}
        }
      }
    },
    "default": {"auto_retry": false, "action": "replan"}
  },
  "rollback_available": true,
  "can_continue_on_failure": false,
  "updated_at": "2026-07-10T12:15:00Z"
}
